video_id,transcript,transcript_type
R_BmT1OJw98,Subscribe if you want to know what the 500 million play button looks like. I don't have one.,unknown
vpRW4JhzfSE,"Every single time one of you subscribes, he will spend an extra second in the Arctic. I have no survival skills at all. We're being dead serious. He's about to get on a plane, and if enough of you subscribe, he could spend a month in the Arctic. I dare you. I'll spend a year there if I have to. I'll figure it. Let's make him spend a year there. Subscribe.",unknown
qXW93Cois2s,"[Music] It's either a pot or a vase. They're the same thing. I'm going to say a pot. It was a fishbowl. Here, I'll clean you off. Oh my. Get a mop out of here. Ow. Uh, money. No. Wait. So, this is a slice of pizza. And Nolan's to my right. Yes. I don't know why you own this. Caress me again. Caress me again. Do you want to taste it? No. A baby wipe. It's a foot. All right. Ready? No. Wait. Oh, cake. [Applause]",unknown
r7f0L48dHpc,"Which of these two waters would you rather drink? Definitely this one. Well, for millions of people around the world, this is their only option. And that's why Mark Robber and I started Team Water. We've already planted 20 million trees with Team Trees. And then, of course, Team Sea, where we raised $30 million to pull 30 million pounds of trash out of the ocean. And now we're back with Team Water. Give 2 million people clean water all around the world. On average, for every $1 you donate, one person will receive clean water for a year. And we're hoping to raise $40 million in August to give 2 million people clean water for decades. So go to teamwater.org or to change someone's life or only a",unknown
Z4hVGCWH1Kc,"We're on a mission to give
2 million people all around the world
clean water. This village in Malawi
now has clean water impacting over
1 thousand people. This is the first of many projects
we’re gonna be doing, and the largest creator collab
in history. Over 3,000 of your favorite creators
are all coming together with over 3 billion followers
combined. This could be one of the largest
philanthropy projects in history. Team Water. All of us, teaming up from
around the globe, to get clean water
that will last decades to over 2 million people
in need. All starting here in Malawi.
Let’s give away some water! We just installed this pump. This is gonna be
the first time we use it. So the first cup of water is going to
the village chief. Oh, he’s downing it! This entire community
used to survive on water collected from
puddles like this. And every drop had to literally be
carried by hand. And that's what they do
every single day. What does this water looks like?
I mean, look at all that dirt. If I drank this,
would I get sick? Yes, you probably shouldn't. I think we can all agree this is
very unacceptable. I mean, look at those
chunks of the dirt in this water. That will no longer happen now that
we have that well. With local leaders, we made sure
that clean water is no longer
a concern here. Wow, look how
excited they are. Over a thousand people that
live around here are gonna be supported by
just this pump. Orkun or Ben, who wants to sub in?
I’m gettin’ tired. These two have 55 million
subscribers combined, and are just 2 of the thousands of
creators that make up Team Water. Here you go. That's a lotta water. Jimmy, is it gonna last
forever? As long as this well
is maintained, which is obviously what
Team Water's gonna do, this well can practically
last forever. The well we started at and this
water pump are just the beginning. Team Water is on a mission
to raise $40 million so that we can provide over
2 million people clean water. Let's keep going! Next, we went to
South America, where we received an amazing welcome
from the people of Colombia. You guys are too kind,
you don't have to do this. Amazingly, the pump for
the local water source was designed from spare parts
by one man with no formal training. You built this with recycled
bicycle parts. Yes And this well, it's what's
currently supplying over 1,000 people
with water. Yes. Oh my goodness. Out this pipe comes water that
the communities are drinking. And at first glance, this water
doesn't look too bad. But really, there are
little particles of dirt and more importantly,
bacteria that is constantly getting
everyone here very sick. Which is why literally right
beside the well that Christo made with
bicycle parts, we built this giant
water filtration system. The system filters water
in 3 stages. This removes dirt, sand,
and large particles. The water is then
pumped into here, which removes the bacteria and
even smaller particles, and then is pumped into here,
which removes the saline so that fresh water can be
pumped through this pipe. If anyone deserves
the first glass of water to come out of
this filtration system… it's Christo. Be my guest. Oh, he's going right for it.
Oh, he's downing it! The water is tasty! Do you approve?
Is it good? Yes! Yes! Yes! Thank you. Even Yolo, with over 33 million
subscribers, couldn't help himself. This water is better
than in my home! Team Water is going around the globe
with all of your favorite creators, like Mark Rober, the Stokes Twins,
and so many more. With the mission of bringing
clean water, the most basic human right,
to millions of people. We also built this massive
water storage container that can hold the equivalent of
20,000 bottles of water, and because we brought
a ton of reusable bottles, we couldn't wait to share the fresh,
clean water with the community. Hey, we got water
for everybody here! But unfortunately,
nearly 1 in 10 people don't have access
to clean water. Which is why we need
your help to raise $40 million. On average,
every $1 donated will provide 1 person with
clean water for an entire year. To power the water filtration system,
we installed a solar farm here, but we couldn't
stop there. We also have a special surprise
for all the little kids. That's your brand new playground! They're way more excited about
the playground than they were about
the water I gave them. We then traveled to the site of
an existing clean water project, where more than 100 kids come
to school just to get clean water. Here you go! Here you go, little man.
Majd, this one's empty! Ah, Jimmy! And even though this community
has access to clean water, there was still
a problem. Since people from over
4 communities have to walk far to reach this central
water source, we added 3 tanks nearby
for easier access. Now I'm gonna show you
how much walking it's gonna save people
in the community. - These jugs are so heavy.
- Come on Jimmy, push! It's hard to believe
nearly 1 in 10 people don't have access
to clean water. So for every $1 they donate,
someone on average will get 1 year of
clean water. - Oh my gosh.
- Well done, Jimmy. As you can tell,
it's very hard to carry water. Team Water goes above and beyond
to take care of people. And of course, we also gave
this community a playground. And then we went just north of India
to Nepal, to this small village where locals hike up a winding trail
to reach this water tap, where they rely on just
a piece of cloth to filter their water. Behind me is
1 of the 3 tanks that’s gonna be providing
clean drinking water to over 300 people
in the community. This tank, when completed,
will hold 15,000 liters of water paired with a mechanism
to clean the water, disinfect it, and make it safe
to drink. Once this is done
being built, how long is the tank supposed to
service the community for? Easily, for at least
15 to 20 years. We've teamed with WaterAid,
our lead global partner, to help provide
clean drinking water. They also support local governments
that handle repair and make sure everything
keeps working. Not only we're providing
the project, but we're maintaining it
for decades to come. We should probably
get back to work. Yeah, we should. You know it’s gonna take over
2,700 kilos of concrete to complete
this water tank. I think I've worked
18 hours today, but if that means these people get
clean drinking water just 1 day early I’ll work 24. Don't look me in the eyes
doing this, bro. Those three water tanks will provide
clean drinking water to 71 households and
around 300 people. On average every $1 donated’s
gonna provide clean water for an entire year
to someone in need. Make sure to donate! And if you're in
the United States, you might think this only affects
other countries. But science creator Mark Rober and I
are hard at work because in 2022, flooding caused
Jackson, Mississippi's entire water system
to fail, which had this assisted living
facility struggling. Having water to brush
your teeth, prepare meals for
your food, to take a bath. And to solve
this issue, we have a machine that pulls
water out of the air? That's right.
An atmospheric water generator. And I've no idea what
that means, which is why I brought
Mark Rober. What does this do? So you know how on
a really hot day your glass gets beads
of water on the outside? Yeah 'cuz, like, the water
goes through the glass. It's not going through
the glass, Jimmy. That water is coming
from the air. This machine
cools down the air, and then it can't hold
that water anymore, at which point you collect it
in this big tank. Plus it purifies it all
in the process. It's basically just squeezing and
wringing out air. How is that
humanly possible? This water is so
clean and fresh, you could use it
in an operating room. Cheers. Wow.
Science is amazing. This machine generates
enough water for the entire
assisted living facility, and they're going to be giving it to
other people in the community who also struggle
to get clean water. Team Water, we are eternally grateful
for everything. And Team Water is also partnering
with Dig Deep to give the people of
Rhodell, West Virginia an updated water system. In previous years,
they just had a lot of problems with the infrastructure
crumbling, so this should do a lot of good
for this community. All the way over
in Ecuador, we're with Ricky Limon and
4 of his friends with over 120 million
subscribers combined, and they're gonna help
clean up the water from this dangerously
contaminated river. Even though it's very beautiful,
the water here is dirty. The river is full of germs,
like E. Coli and Giardia. And unfortunately for the village
right next to the river, it's the only source of water for
them and their children. 34% of kids under 5, they got
malnutrition and stomach issues. So to change
these kids' lives, we're building filtration for each of
the 3 water storage tanks, using reverse osmosis filters
to make the water safe to drink. It comes out
completely clear. It's like magic. Great! I know that means
""very good"" Yes, this is
very good. And with some help,
we're giving water filtration bags to everyone in
the community so they can have clean water
with them anywhere they go. It will work so you can
drink the water. Did you tell her what
the bag is for? Yeah, I just told that, bro. I was just checking. Thanks to the Amazon Rainforest
Investor Coalition for supporting the amazing work
that's being done in this video. Meanwhile, across the world
in Zambia, fitness creator Browney is at
the largest community in this video. There are a staggering
9,000 people that do not have access
to clean water here, and their only option
is to dig shallow wells that often
get polluted. It's not covered,
so when we receive rainfall, there’s flooding into this well,
it gets contaminated. You'll find yourself
in the hospital. So we installed 3
10,000 liter water tanks to make sure that every last one
of the 9,000 people here have access
to clean water. Is it good?
Yes, good! Now that these tanks are supplying
brand new water stations all around
the community, they can finally fill
those old, unsafe wells. Let's go. Putting a stop
to this! The projects you guys saw in
this video are just a sample size of what we're gonna be doing
with Team Water to give 2 million people clean water
all around the world. Five years ago,
we did Team Trees, where we raised $20 million
to plant 20 million trees, and 3 years ago we did Team Seas,
where we raised $30 million to pull 30 million pounds of trash
out of the ocean. And now we're back
with Team Water. Only this time is
the audacious goal of $40 million. To give 2 million people
all around the world clean water for
decades each. And none of this
would be possible without our
lead global partner, WaterAid. If you want to donate, just click
the donate button down below. Or you can go to
teamwater.org, where you can see
every single donation, you can leave messages
when you donate. You can also see
the top donaters. And me and Mark Rober know
we can't raise $40 million on our own which is why you're gonna see
thousands of creators uploading videos, TikToks, shorts,
reels, Instagram photos about Team Water. And on top
of donating, I need you guys to go engage
with all that content. I need you to share it.
I need you to spread the word. And I need you to harass
your favorite creators to support
Team Water. Do your part to
make this a success. If you're watching this video
when it first goes up, you'll notice
the counter doesn't start at $0. It's starting at
$500,000. That's because Shopify,
who powers the Team Water merch store has stepped up with
a $500,000 donation. Thank you, Shopify. Also a special thanks
to YouTube, who will match the next $2 million
donated to Team Water. So if you donate to
Team Water right now, instead of giving someone 1 year
of clean drinking water, you'll actually be
giving them 2.",unknown
zxuICI0kL3s,"Don't turn around. Win $10,000 to win the money. You cannot turn around. >> I'm not turning around, Jimmy. There's nowhere. >> There is literally nothing you could tell me to make me turn. >> I'm not turning around. >> You've got 10 seconds. >> Sabrina Carpenter. >> You literally could have just said hi to Sabrina Carpenter, but I don't know if it's safe here. 5 4 You can turn around. >> No, I can't. Jimmy, >> this is your 10 grand. Turn around. You would have actually won 100 grand. I tried to tell",unknown
R1SFXJo-FlE,"Hit the subscribe button to blow up this TNT. Ready? Three, two, one. Subscribe. Oh god. Oh god. Okay, so uh if you haven't already, make sure you subscribe. I need to get really far away cuz this is a big explosion. I should go further back. Further back. Further back. Okay, I think this should be good. Let's go. Oh. Ah.",unknown
lQz5aqjZ3lQ,"I'm giving away $10,000 to my money. I'll take that. Oh, hey, my banana. You may now present the ring. Oh, man. I'm sorry about that. This should cover the ring. Whoa. Whoa. That movie actually looks really good. I kind of Oh my goodness. I'm sorry about that. Where'd she go? That way. That way. Okay. [Applause] Hey, at least give me a 20. Give me my money back. Hey, you got to pay for that. Hey, my money. Stop him. Wait. My car. What the heck? Jimmy, get in. You sure? Okay. Go, go, go. Follow him. Hey, on him. I need that briefcase back. Oh, look out. Give me my money back. Hey, who are you? Come here. Who are you? Who Who are you, babe? I just wanted to spend more time with you. If you just told me that, I would have took you to see Bad Guys Too. You want to go watch it? Yeah. Yeah. Let's go on a date. Yeah. Hey, wait. That's my money. No.",unknown
EiFcNbXBqeo,"Help the Lord. Let's go. We got this. Let's go. Oh my god. Don't step out of bounds. We got to run. Can't move, but stay out. This is insane. There you go. Almost there. Come on. Oh my god. Wait. Help. Please. I got it. You're almost there.",unknown
