video_id,transcript
tqo0h5jvtsE,"So, about the executive evaluation, they're super charismatic, but they like to play hard ball, so let them lead. Also, they're known for their tantrums, especially before lunchtime. So, just let them lead the questions. Whatever you do, don't stare. Good luck. [Music] So honored to uh do business with all of you. I know you have lunch soon, so I'm not going to take much of your time. Uh what questions you have for me? >> Why Grand Learning and Koda? >> Well, we're focused on uh very similar problems with very similar customers. And we take a very similar approach. Together, we're building a product that's kind of like a smart friend that can work with you, not only fixing your writing, but organize your thoughts, connect you with all your other applications and information, and solve lots of problems for you. >> What's the future of Grammarly? >> Grammarly is going to be a platform for all of your AI helpers, and they're going to be able to work across all your different applications, take actions for you, and make collaboration really easy. >> What's your favorite part about working at Grammy? It's >> a great question. I love working on products that help millions of people every single day. >> Is AI gonna take over jobs? I don't want to eliminate sales. >> Well, AI is definitely going to change how you work. Um, but I don't think it's going to eliminate any jobs. We're really going to do is give you new helpers. So, you might have a helper who could help you design signs or a different helper that could help you track your sales. Uh, and that way you can focus on making the best lemoning. >> Can Grammarly do my chores? Grammarly can't do your chores yet, but we're working on solving lots of other problems for you. So, at least we'll be able to organize how you do your chores, even if we can't do your laundry for you. >> How do you decide what you think to add to Grammarly? Do you just pick the most fun ideas? >> Not quite, but we do listen really closely to our users and work on ideas that we think are going to have a lot of impact. And that's definitely fun for me. Listen, I'm on a mission to change how humans and AI work together to get more done. I hope you're all on board to support me with this vision. >> We approve. >> As the chairman of the board, I have a very important question to ask. You got snacks here, right? >> All the gummies you want."
f_XVxYjmWj8,"Some of the challenges with notion that made me consider alternatives. A lot of it had to do with pricing going up and my team using less and less of those features. What I was looking for was to have a tool where members of my team would be empowered to make updates within their own departments without having to pay for a seat for every single person who makes updates. The migration process from notion was very seamless. It didn't require any further editing from me. So, if that hadn't been the case, it might have taken me longer to make a decision. But that sold it for me. Using Kod and Grammarly together, it's just a beautiful marriage of two tools for two work processes that are so important to my business. I can create really clear documentation. and I can catch any errors and ensure our brand style guide is implemented even in how we talk about clients and their products."
G7BhPpYiGB4,"Using Koda and Grammarly together, it's just a beautiful marriage of two tools for two work processes that are so important to my business. I can create really clear documentation. I can catch any errors and ensure our brand style guide is implemented even in how we talk about clients and their products. Hi, my name is Maddie Osman. I am the founder of the Blogsmith content agency for B2B technology brands. I was looking for a tool where members of my team would be empowered to make updates within their own departments without having to pay for a seat for every single person who makes updates. In KOD, you're only paying for the user who creates the initial documents. From there, other team members are able to edit those documents without me needing to add paid seats for the privilege. KOD empowers team members with the information that they need in order to complete their task. Whether it's client specific information, their persona documentation, and standard operating procedures. With Grammarly, we make use of the custom style guide to make it really straightforward for my team to be on the same page and not waste a lot of time on unnecessary edits. With Grammarly and KOD, my team is finally able to have an effective single point of truth for both our style rules and the essential processes that underly our content creation. [Music]"
O0qdEu7VjDs,"The biggest benefit of using Grammarly in my work is that it helps me be the best writer that I can be so that I can be an effective partner for my clients. My name is Alyssa Towns and I'm a freelance writer at Words with Alyssa LLC. Prior to working with Grammarly, and I don't think I realized it at the time, my writing just wasn't always super clear. Looking back, I realized that Grammarly was not only improving my writing, but also helping me become a better and stronger writer, too. Grammarly has analyzed over 25 million words since I started using it over 5 years ago. And it's helped me maintain long-term relationships with my clients, provide high quality work to them, and prior to freelancing. It's really helped me succeed as an internal communications professional. I use paragraph rewrites, clarity suggestions, and proofreading the most in Grammarly because my secret sauce is getting that first draft down on paper, getting those initial thoughts out, and then using Grammarly to really bring it to life, clean it up, and turn it into the best version that it can be. My favorite way to use Grammarly's AI feature is to generate a starting point for longer communications to get that first draft out so that I can focus on the more strategic pieces of the communication itself. No matter your role in communications or what type of work you do, Grammarly works wherever you work and caters to you to help you be the best, most effective communicator that you can be."
WpRFs0gUYRs,"If I were to speak to my past self before using Grammarly, I would say, imagine having a personal writing assistant that not only catches embarrassing mistakes before hitting send, but also helps you articulate your ideas clearly and improves your writing skills every time you use it. My name is Stacy Rashan. I'm an educational technology consultant and author. Grammarly's AI makes me a more confident writer. With its assistance, I'm able to craft clear and more effective messages. Those who use Grammarly know it's a superstar in helping you strike the right tone, and I love the ease with which you can toggle between more friendly and more formal tones effortlessly with some of Grammarly's newer features. My favorite new Grammarly feature is paragraph rewrite. While Grammarly was great at catching errors and suggesting improvements in the past, paragraph rewrites have really taken everything up several notches. To me, it almost feels like I used to have a copy editor with Grammarly, and now I have a line editor, an assistant that improves the overall structure, flow, and coherence of my writing. I also just love the implementation of the paragraph rewrites. It's such a natural flow. I simply tap the sidebar to see suggestions there in line. I can undo any changes that I don't feel right and then I can choose to accept and continue on. I never hit send on a post without checking with Grammarly first. Grammarly will make you a more confident and effective communicator and truly helps you develop as a writer while maintaining your personal style."
dvAh0pp7tBk,"Introducing Grammarly like you've never seen before. Your all-in-one writing essential. Today, we're checking out Proofreader, a gem of a tool for notes, proposals, emails, and everything in between. Proofreader goes beyond just spelling and grammar. It helps elevate your writing by refining structure, clarifying your main point, and improving overall flow and logic, providing instant feedback, smart suggestions, and more. You decide what stays and what goes. Total control, zero guesswork. And that's just one of Grammarly's full lineup of writing agents. Writing that's clearer, sharper, and more you. Grammarly's proofreader makes it easy. What's next on that to-do list?"
a2nYw3gao7E,"Introducing Grammarly like you've never seen before. Your all-in-one writing essential. This is Paraphraser, your go-to tool for writing that's sharp, clear, and ready for whatever hat you put on. It works like this. Here are some notes from a busy meeting. Paraphraser helps turn messy notes into polished writing. No extra effort required. Click on this icon to choose the tone of voice. And voila, professional, casual, friendly. You name it. Today, it's all business. With just a few clicks, the message is clearer, sharper, and more professional without losing your voice. Paraphraser is just one of Grammarly's powerful agents. Grammarly's got everything you need to write with confidence, no matter what you're working on."
y883pM6-ya8,"Introducing Grammarly like you've never seen before. Your all-in-one writing essential. Writing a strong paper can feel like a lot. Research, structure, clarity, and meeting that grading criteria to get the best outcome possible. Grammarly's AI grader is here to help. When you've got your paper in a good place, move over to the side panel where you can add relevant class information, upload a grading rubric, and analyze your paper for a potential grade. You'll see a breakdown of strengths, weaknesses, and personalized suggestions tied to your course goals so you know exactly where to focus. Grammarly's AI grader means less guessing, more clarity, and a clearer path to better grades all in one place."
m0JR03nxy5k,"Introducing Grammarly, like you've never seen before. Your all-in-one writing essential. The best writing reflects you clearly and responsibly. Grammarly's AI detector makes sure everything you write stays true to you. When you're done with your draft, head over to the sidebar and click the AI detector icon. It shows you if anything sounds off, like awkward phrases or redundant transitions. Plus, it actually explains why so you can fix it. And if you want to use AI text, just click generate citation and it keeps things crystal clear. There, clean as a whistle. Because if a paper has your name on it, it's by you. And Grammarly makes sure it stays that way."
VBAQr43v5hc,"Introducing Grammarly, like you've never seen before. Your all-in-one writing essential. Recycling is great for bottles, not borrowed sentences. Grammarly's plagiarism checker helps you stay original by catching borrowed lines before they slip through. Here's how it works. Once your draft is finished, click on the plagiarism checker icon in the side panel. It checks the writing against a massive database and flags any copied phrases, complete with the percentage and direct links to sources. Way easier than wasting energy by clicking around trying to find the source. No recycled lines, no copy paste scraps. Grammarly's plagiarism checker keeps your writing fresh. [Music]"
daGUD3CB7UU,"Introducing Grammarly like you've never seen before. Your all-in-one writing essential. With Grammarly, your writing isn't just clear, concise, and confident. It's also well supported. That's where Citation Finder comes in, your built-in research detective. It scans your draft, spots the claims that may need backup, and gets to work finding reputable resources that support your statements. Citation Finder will show you whether your claims are supported, debated, or contradicted. No more pulling facts out of thin air. No more going off vibes. With Grammarly Citation Finder, you've got the evidence, the leads, and the airtight case. All that's missing is the trench code."
QoI7QEvAljo,"Introducing Grammarly like you've never seen before. Your all-in-one writing essential. Say hello to Humanizer, a tool that ensures that when you do use AI, it never sounds generic or stiff, adding warmth and nuance to your reports, presentations, pitches, and more. So, you're loving the structure of this email to your boss, but you're not liking how it sounds. Humanizer allows you to select the tone of voice that makes sense. Select from a range of voices such as the everyday, the executive, the scholar, and the precisionist. You can even design your own voice by adding a sample of how you'd like your writing to sound so your work always sounds like you. One click is all it takes. Grammarly's humanizer preserves your content without sacrificing personality. Humanizer will give you lineby-line improvements that make sense for you. And that's just one of the powerful features built into Grammarly's roster of agents. What voice will you choose today?"
JQX7SdUJGeo,"[Music] This is Grammarly's AI writing app. Your writing from start to finish, all in one place. Whether it's emails, essays, or proposals, Grammarly helps you brainstorm, draft, refine, and polish without juggling multiple tools and always in a way that sounds like you. Just click the AI chat and your writing space is ready with exactly what you need. From a blank page to a polished draft, Grammarly keeps everything flowing in one place with less hassle and more focus. Grammarly's AI writing app for clearer writing, faster results, and less stress. [Music]"
EbG-mKTXCBo,"[Music] Introducing Grammarly like you've never seen before. Your all-in-one writing essential. Imagine a little voice on your shoulder, whispering clarity, credibility, and citations. Expert review gives you that voice of reason, a seasoned expert in your field by offering feedback only someone in the know could give. Whether it's business, science, or something niche, expert review is inspired by top tier authors, peer-reviewed sources, and seasoned pros in that field. It can help you strengthen your arguments, draw direct quotes, frame your thoughts, and give your paper that experts touch to make it truly shine. You can even select from experts based on a series of categories. With Grammarly's expert review, you're not just writing with confidence."
4qVL0BIM7H8,"[Music] Welcome back to your Grammarly admin video series. In this video, we're walking through your analytics dashboard. You'll learn how to analyze your team's usage of Grammarly so you can discover opportunities to enhance productivity, promote brand consistency, and improve communication across your organization. To get started, head to the analytics tab within your admin panel. If you're on our enterprise plan, you'll have access to effective communication score insight. We cover that in another video. Once you're in the dashboard, select the date range you'd like to explore and choose whether you want to see daily, weekly, or monthly results. These views help you analyze trends over time and spot shifts in behavior or adoption. This dashboard shows where your team uses Grammarly most frequently, like Slack, KOD, or Gmail. It gives you insight into communication channels and where Grammarly offers the most support. This helps you understand adoption and where there may be opportunities for even more impact. Now, on to the good stuff. Scroll down to get a sense of how your team's writing is improving over time and dive deeper into the types of suggestions that are most common. These trends show you where your team is growing and where they still may need support. Your analytics dashboard also shows you the top tones coming through in your team's writing. This gives you visibility into whether your team's communication reflects the tone your brand strives for, which is crucial for messaging and improving brand consistency. Toggle between views to see usage across all features or AI features only to get a sense of how your team is leveraging Grammarly's AI compared to your other tools. If you're on our enterprise plan, you can go even deeper by navigating to authorship usage where you'll see the breakdown of human written versus AI generated text across your organization. At Grammarly, we believe AI should enhance your team's skills and amplify every team member's impact. Authorship helps you uphold this responsible AI usage and ensure it's supporting, not replacing human communication. If you want even more powerful insights, enterprise teams can also use the analytics API to integrate Grammarly usage data directly into your internal business intelligence systems. This allows you to tie communication data to business outcomes and demonstrate Grammarly's value with data that matters to your organization. Finally, you should encourage your employees to track their own progress in their personal analytics dashboard. From here, they can review top tones and get a clear view of how they're improving their writing over time. Ready to dive into the data? Head to your admin panel today to start exploring Grammarly's analytics dashboard. [Music]"
1_ZczeKkduA,"Welcome to your Grammarly admin video series. As an account admin, you play a key role in setting your team up for success. These quick videos will show you how to activate Grammarly's most powerful features so your team can write with clarity, consistency, and confidence from day one. In this video, we'll show you how to set up brand tones and style rules. Two features that tailor Grammarly suggestions to match your brand's unique voice and writing standards. You are setting the tone for your entire team and we're here to make that easier. Let's start with brand tones. Teams spend countless hours manually ensuring their brand is consistently represented. What if that effort was automated? Whether your brand is casual and friendly or polished and professional, Grammarly helps reinforce that voice everywhere your team writes. You can designate brand tones that guide your team to strike the right note in every message. To get started, head to the admin panel and begin setting up your team's tone profile. We'll walk you through a few quick questions about how your brand sounds. Things like how formal, optimistic, or direct your voice should be. From there, Grammarly generates a custom tone profile based on your responses. You can fine-tune it further by searching for, adding, or removing tones so it reflects exactly how you want your team to sound across different channels. Once you've saved your settings, these tones will instantly start informing your team's writing, providing real-time tone suggestions that help them stay on brand. Next up, style rules. Through this feature, you can define how your team should refer to key terms, follow inclusive language and compliance standards, or avoid off-brand language. For example, if your team should always use full product names in external messages, never acronyms or abbreviations, you can set that as a rule that will surface and correct them as they write. To create a new rule, head to the style rules tab in the admin panel. From there, you can add individual rules or upload a list of all of your rules at once. You can add explanations for each rule so your team understands the context behind the suggestions. And you can even share a link for team members to learn more. Grammarly surfaces these rules in real time so your team gets brand specific writing guidance exactly when they need it. Once everything's set, tone and style suggestions appear automatically across your team's everyday tools like Google Docs, KOD, email, Slack, Microsoft Teams, and more. It's an easy way to keep your brand voice strong and your team aligned. No extra effort or training required. Grammarly's AI assistant for work is here to support your team and help your brand shine through and every word. Ready to get started? Head to the admin panel to set up brand tones and style rules today."
CNDU5v7B_FU,"[Music] Welcome back to your Grammarly admin video series. In this video, you'll learn how to invite users to Grammarly using a variety of methods from quick manual invites to more automated and secure options that integrate with your internal systems. No matter how your organization is set up, we've got you covered. Let's start with single signon or SSO. SSO allows your team to log into Grammarly using your preferred identity provider like Octa or Microsoft Entra ID. It keeps things easy for your team with no extra passwords to remember and gives your IT team greater control over access and security. To set it up, you or your IT team will first need to add Grammarly to your identity provider. From there, fill in the authentication fields in your Grammarly admin panel. test the connection and then activate it for your team. Once SSO is live, you'll get a custom login link you can share with your team to get them started. Next is SKIM provisioning which is available only on enterprise plans. SKIM stands for system for cross-domain identity management. But more importantly, it's one of the most secure and automated ways to manage user access. For example, you can give every new hire access to Grammarly the moment they join and they'll receive an invite. When skimm is enabled, new users are automatically provision based on rules you define in your identity provider. No manual steps required. If you're ready to set this up, reach out to our support team or your Grammarly account representative. We'll walk you through it. You can also invite users directly from the admin panel. Navigate to the members tab under member management and choose how you want to invite them. You can add emails manually one by one. Upload a list to add emails in bulk or copy and share an invite link. If you're already using SSO, users invited this way will simply be redirected to your SSO login page and access will only be granted if Grammarly is assigned to them through your identity provider. Once set up, admins can manage user roles and permissions anytime. Here are a few different types of users you can assign. Other account admins like you who should have full access to IT configurations, billing, and more. Account managers who can configure writing settings across teams and view usage data across the company. and users who receive writing suggestions and can view their analytics but can't make account changes. On enterprise plans, you can also set up custom roles with the exact permissions you need for each. Whether you're inviting a few teammates or rolling out Grammarly across your entire organization, you have flexible options that give you control, security, and scalability. If you need help at any time, visit our help center or contact your Grammarly account team. We're here to help. Ready to get started? Head to the admin panel and invite your team today."
5wmTbiiaIuU,"[Music] Welcome back to your Grammarly admin video series. In this video, we're covering a key feature available to customers on our enterprise plan, the effective communication score or ECS. Your ECS helps you understand how strong your organization's communication is by analyzing your team's activity in Grammarly and comparing it to industry benchmarks. It's a simple way to capture the impact of Grammarly and get insight into the quality of your organization's communication. Let's walk through how to read your score and how to improve it over time. To get started, head to the team overview. Under the analytics tab within your admin panel, at the top, you'll see your organization's ECS, and just below it, you'll see what your team's score would have been without Grammarly. You'll also see a breakdown of how Grammarly has improved different aspects of your team's communication like correctness, clarity, inclusivity, style consistency, and brand compliance based on the suggestions that your team has accepted. Click on your detailed score analysis to learn how the score is calculated, how to interpret it, and how you stack up against others in your industry. This analysis gives you a more actionable picture of what Grammarly is improving and where there's opportunity to grow. For example, if your style consistency score is lower than you expect, it may be time to update and reinforce your brand style guide within Grammarly. Which brings me to a few quick ways to raise your score. Set up brand tones within Grammarly to guide your team's tone in real time and improve brand compliance across your org. Create style rules to align on preferred terms and formatting, raising your style consistency score. Invite teammates to Grammarly and streamline access by enabling single sign on to ensure everyone is communicating more clearly and accurately. We have step-by-step videos covering each of these, so be sure to check those out. Want to dive even deeper into your team's communication trends? Just scroll down from your ECS to explore your full analytics dashboard. Don't worry, we have a video for that, too. Strong writing fuels better work across every department, and the effective communication score helps you prove and strengthen that impact. Ready to explore your score? Head to the team overview page in your admin panel today."
