video_id,transcript
5Ugu7Mxsi38,"Welcome back to your Grammarly admin video series. In this video, we'll show you how to make the most of Grammarly's generative AI features, including how to customize settings and manage access for your team. Grammarly has been using AI to power writing assistance for over a decade. Now, with our advanced generative AI capabilities, your team can get realtime inline AI assistance to write and work more effectively. With Grammarly AI, they can surface key insights for faster alignment and to keep work moving. Generate new content like project proposals, blogs, and support documents. Write where they're already working. Draft quick, professional replies to emails, or rewrite messages to sound exactly how they intended. It's intuitive, fast, and built right into the apps your team uses, saving them from context switching between tabs all day long. And it's designed with trust and safety in mind. Grammarly is committed to responsible AI and data use. We've invested in enterprisegrade compliance certifications and attest stations, including ISO 42,01 to ensure our practices meet global standards. As an admin, you have full control over how AI is used across your organization. You can choose which AI features your team has access to, like proactive suggestions or rewriting support, and turn them on or off for specific groups or for your entire organization, so you control how Grammarly shows up in their workflows. Once enabled, your team can start using AI right away without needing to navigate to another tab. It's a simple way to elevate their writing at scale. And if you're curious about how your team is using AI, you're able to track engagement in your analytics dashboard, but more on that in a future video. Grammarly's AI assistant is built to support your team while giving you the controls to guide how it's used. Ready to get started? Head to the admin panel to manage AI settings for your team today."
q2jR6PmLOqU,"[Music] Welcome back to your Grammarly admin video series. In this video, you'll learn how to save your team time and reduce repetitive work using two powerful tools, snippets and knowledge share. Together, they help your team access company knowledge so they can stay aligned and avoid confusion without breaking their flow. Let's start with snippets. Snippets are reusable blocks of text that your team can insert instantly using a simple keyboard shortcut instead of typing it out every time. You can create snippets for things like common customer responses, product descriptions, your brand's boilerplate, or internal updates you send on a regular basis. While each user can always create their own snippets, admins can scale this time-saving feature by creating and managing snippets at the account level to ensure everyone has access to company approved messaging. To set these up, go to the snippets tab in your admin panel. You can add snippets in two ways. Upload them in bulk using a CSV template or add them one by one just like you would with style rules. Each snippet includes a title, shortcut, and body text, which can be a few words, a sentence, or even an entire paragraph complete with links. You can always preview or edit your snippets later. Want to personalize these even further? You can assign snippets to specific groups of users with collections, so sales, support, and marketing each get what they need without extra noise. This level of customization makes it easy to support every team with relevant, reusable content. Once snippets are live, your team can use them anywhere they write. Just type the backslash key to search and insert a snippet instantly. No more copy pasting or rewriting the same message twice. Snippets help your team move faster, write smarter, and stay consistent without the extra effort. Next up, knowledge share. An easy way to reduce confusion around acronyms and team jargon. When enabled, Grammarly will automatically detect jargon in your team's writing. Users can hover over a term to see its definition, related documents, and who to contact for more context. This keeps communication clear and gives new teammates or crossfunctional collaborators easy access to information. To add terms, head to the knowledge share tab in your admin panel. From there, you can add individual terms or upload a list of all of the terms your team should know at once. You'll also find collections of preset terms you can choose from for specific industries and teams. Within each term, add a description that defines the term or acronym and link supporting materials like documentation or Slack channels. You can also assign ownership to subject matter experts so your team always knows who to contact to learn more. Once your terms are uploaded, Grammarly will automatically highlight them across the tools your team uses every day. Just make sure your team downloads Grammarly for Chrome and Grammarly for Windows or Mac to take full advantage of these features. That way, all they need to do is hover over a term to get instant clarity. Snippets and knowledge share help your team move faster, write smarter, and stay aligned without slowing down to search, retype, or clarify. Ready to save your team time? Head to your admin panel to set up snippets and knowledge share today."
xTPNx0Gt4Sg,"Friday is company karaoke – ‘90s pop theme. And, well, I’m something of a karaoke connoisseur. What’s this? Brad wants a plan to reach a new quarterly target... and he wants it by Friday? Hmm, trying to throw me off my karaoke game? Not gonna happen. I’ve got Grammarly. Time to brainstorm. Perfect. Let’s build this out. What’s next? Let’s update my outreach messaging. Something...engaging. Nice! This new messaging is perfect. OK, let’s see what the experts might say. Right! Starting with metrics is way stronger. This is good to go. Hey. Amazing work on that plan. Can you present it to the team next week? No problem. Thanks. Nailed it."
W2P7eixJOgc,"So, I’m writing an essay on cats. Cats in art history. I’m an art history major, and this final is due on Friday. Same day I’m going on a road
trip with my best friend Gabbie. Luckily, I write with Grammarly. What once took me hours now takes minutes. So I can focus on what matters most, my voice. We begin in Ancient Egypt and then the Renaissance, but also Impressionism. And of course, the internet. - Hey. 
- Hey. Have you started packing? Totally. I have not. Finish that paper, you got this. Thank you. - Bye.
- Bye. OK, back to it. Time to double-check my facts and citations. Oops, I made a few debated claims. Fixing those. Nice! No more embarrassing mistakes... But what kind of grade are we talking here? Hmm. Not my dream grade. Let’s clarify this. Shorten that, and... Boom! We have pretty high standards. Am I right?"
4pnUGdXRXN8,"Rocks. I’m writing a paper on them. This is the last thing standing between me and break, and I need to crush it. I’m a geology major. A real rocker. Oh, I’m also in a band... and our show is tonight. Thought I was gonna say a rock band, huh? Of quartz you would. Luckily, Grammarly has transformed my writing. Making my process way faster and my writing way better. A win-win, for my major and my music. This should probably sound more academic. Perfect. Much boulder. Get it? Because boulders are rocks. I’m here all week. Alright, let’s make sure my voice is coming through. Eee, that’s not good. I need some citations here. Got to fix that. Oof, that’s a relief. I’m done! Yes! What time is the show? What time’s the show? It’s..."
