video_id,transcript
gflvhOeZNnw,"There are so many aspects of our lives that make writing and written pretty darn hard. We started working with Kod and Gramly because we were looking for technology partners that would help us supercharge our folks ability to be amazing at what they do. Zapier is an AI orchestration platform that gives people and organizations of all shapes and sizes the power to build automations, entire pieces of software without having to know how to code. >> Being able to have the Zapier brand guidelines right in Grammarly helps my speed to execution because I know the things that I'm writing match what our brand marketing and our content teams would want them to say. And so it takes out these layers of approval that would have needed to be there before and allows me to be really independent and create content and launch it faster. We use KOD rather than other tools because of the ease of use and the versatility of the product. So it's really easy to format, share, and show information in a way that's digestible. If we didn't have KOD, I think we would just move a lot slower. >> The thing I want to underscore about working with Grammarly and KOD is that it's about more than the technology. It's about feeling like you have a trusted partner. That's something that is still pretty distinctive in the market. Something we really appreciate about the work that we get to do with Kota and Grammarly."
MDZrECbuCgo,Propaganda we are not falling for. An AI assistant that makes you sound like everyone else. Sending that risky text without an edit. The 5 to9 before the 95. I making us lazy. Proper grammar makes you sound old. Voice memos. Adding L at the end of a message to sound less serious.
LRZ6r2N2x-I,"Hello. >> Hello. >> At Grammly, what do you do? Explain it to me like I'm 10. >> Think about trying to take the best players from your favorite sports teams and trying to bring them to the best team, Grammarly, in the world. That's my job. >> What do you do at Grammarly? Can you explain it to me like I'm an 8-year-old? >> My uh job is analytical linguist. So, anytime that Grammarly does anything with your writing, sometimes it works and sometimes it doesn't work. and when it doesn't work, we want to try to fix it. >> I try to kind of story tell um and explain how Grammarly could help. What I do at Grammarly is help our customers understand all the really good things that they get when they buy Grammarly. >> What do you do at Grammarly? Explain it to me like I'm eight. >> Good question, Lucy. I am in marketing and my job is to explain what Grammarly does and convince people to sign up and use our product. [Music]"
DP17ooOf_NI,"Zapier is the most connected AI orchestration platform which means we connect over 8,000 different tools through AI and automation. Transparency is actually one of our company values at Zapier. That means that we work in public and one reason that we do that is because we are a remote company. Kota was one of the probably first products that I remember coming into Zapier and just loving that the company used. Kota plays a pretty critical role in helping Zapier have crossunctional collaboration. I manage a team of nine people and as a tool KOD is really important for me for visibility and transparency. We use KOD on the marketing team as a central hub for information. So anyone at the company can go into the KODOD and to see the marketing strategy. They can see all of our planning documents and then they also have visibility into what I'm working on as well as their teammates. So it's a really nice two-way street. >> One of the biggest things that helps us is actually Kod's rich set of APIs. You've seen teams adapt KOD to be really customizable. One of the ways that we've been able to build really powerful AI systems because we use KOD is by connecting KOD automation and our own Zapier to be able to get models aware of content from what our projects are, what our teams are working on. We don't have private Slack channels. Everything is out in the open and that includes our async communication. So having KOD as these open docs that anybody can access really gives us that extra layer of transparency that's built into the company inherently. [Music]"
9FhPaxfRO4Y,"Is it possible to get a job in 24 hours? So, I was curious how quickly I could get a job. And so, rather than focusing my efforts on networking and building out a resume, I decided to start by cold emailing and DMing a bunch of different companies to see if they would hire me. Now, things were not looking good in the first couple of hours because despite literally messaging dozens of places, I wasn't getting any responses. But then it hit me. It was probably because my messages were pretty unprofessional, looking like this. In my quest for quantity, I ended up sacrificing quality. But I didn't have time to sit down and appropriately curate a professional and personalized message to each of them. But luckily, Grammarly exists, which is an AI writing assistant that helps you write better and faster to optimize for your work. And since they have a keyboard app and a desktop app, you can write on the go no matter where you are. The best part, though, is you could tailor your writing based on whoever you're talking to. So, perfect for job hunting. And since it works seamlessly in all of your apps, I figured this was my best shot at getting a response. And after just a few messages using it, I actually got some bites. But don't worry, I'm sticking to YouTube. But go try Grammarly today. I mean, all the features are free, so why not? [Music]"
zfqHawI17es,"Ever since I started using Grammarly, writing has been a lot more easy. Now, as a full-time programmer and a new hire, I found that writing professionally takes a lot more brain power. Whether it's a Slack message or an email, I try really hard to get the tone right, like being polite without sounding passive. It works right inside email apps and Slack, which is super convenient. And I use it to clean up phrasing. And whenever I ask myself, does this sound okay? What I love is that it adapts based on who I'm writing to. Like, if it's my manager, I can set my audience. And Grammarly shifts the tone to make me sound more confident and clear without overthinking it. All the features I'm using here are totally free and I don't have to copy and paste anything into another tool. It just works where I work."
GTW5eAfL2tc,"This what? 240,000 is going to get you in Canyon Lake, Texas. It's a speed course. So, let's take a look. Grammarly helps me get all my work done with speed using the AI tools like garage. Best part about Grammarly, they work with over 500 apps plus websites. So, they work where you work. This is not brought to you by Grammarly and the any tools like the We have a beautiful view here of Grammarly and all their benefits. Come on. Come on, man. Stay with me. This tub brought to you by Grammarly and the AI tools they provide. But show that screen and let's watch this. While I have your attention, we're talking about Grammarly and the benefits for a professional. Through the AI tools they provide, they can help you sound confident in emails. The AI tools can rewrite for clarity. And the AI can help streamline other processes, too. Download Grammarly."
nrPEDbmQWDc,"For $100, can we read through your emails to see how Grammarly can improve some of your sent emails? >> Sure. Can you pull out your phone? Your most embarrassing emails. >> Most embarrassing email. Oh god, this is embarrassing for sure. My name is Jiren and I'm dropping a line to see if has any jobized holes that match the shape of my skill set. I live in Ridgewood and I'm no stranger to brickandmortar, retail, work, fashion, and clothing reset. >> So now, can you copy that whole thing? All right. Is in Grammarly. We're going to make it more persuasive, confident, friendly. Now, it's going to revise. So, now what I want you to do is read this revised email. >> Hey there, I'm Jiren and I hope you're doing well. I wanted to reach out and see if there are any job opportunities that might fit my skills. I'm currently living in Ridgewood and I've got a background in brickandmortar retail, fashion, and clothing resale. Looking forward to hearing from you. >> What do you think? >> Good. I'm definitely going to use Grammarly now and correct my literary beta posture. >> Here's your $100. And to everyone watching, go check out Grammarly free."
a3hPrcebSOQ,"[Music] [Music] If you need help setting boundaries in the workplace, Grammarly's got your back. Grammarly is an AI writing partner that helps professionals confidently communicate. After opening the Grammarly Assistant and typing your prompt, choose the tone of your message, and you can even shorten it to get right to the point. Once you're ready, hit insert. And just like that, Grammarly has crafted you the perfect out of office away message so you can sit back, relax, and enjoy your PTO."
xDT4ujlwPv4,"- Before Zapier was using
tools like Coda and Grammarly, we were looking for technology partners that would help us
supercharge our folks' ability to be amazing at what they do. Coda was a really promising
way to help us make it easy for people to find the
information that they needed. That's the place where work happens. Hi, my name's Brandon Sammut, Chief People Officer at Zapier. Zapier is an AI orchestration platform that gives people and organizations the power to build
entire pieces of software without having to know how to code. We have an effort that my
own team leads at Zapier to help HR teams all over the world use AI and automation to supercharge their work. We organize that entire effort on Coda. Can we call that effort HR by Zapier? The impact of an effort like HR by Zapier, it's able to be much more of a guide and a partner to our customers. And then of course, we're all about automating
tedium out of work. We built an integration
across Zapier and Coda that unlock even more powerful ways to make sure that when
I do something in Coda, I can automate an update
to the folks that need it. The biggest benefit of working with Coda and Grammarly are the teams
that we get to work with, feeling like you have a trusted partner. They feel like we're actually
on a journey together. That's something that is still pretty
distinctive in the market. That's something we really appreciate about the work that we get to
do with Coda and Grammarly. (gentle bright music)"
RpZBJo1ckmw,"What do you write? Romantic poems. Well, what if we wrote Zanab poem right now and use Grammarly's AI writing tool to help us out? My name is Rush. My girlfriend is living in France and I am here living in stumble. I feel insecure about my writing because probably my English not enough for that. Okay. Her eyes like my story of life. Her touch feeling warm of the sun. My love for Z will be forever. How would you want to try to improve this? Like I want to change the style to Edgar Alen Po. Write the below poem Edgar Allan Poe style. Go ahead and read it. Arise like glaze did steer my soul. Her touch a flame that made me hold my love for Zanap ever shall be. Wow. Maybe you could use Grammarly to help you write more letters to Z. Yeah. Yeah. Thank you. That's perfect."
fruwHfVjWr0,"Now you only need one subscription instead of multiple AI tools. One of my secret weapons is asking Grammarly to identify gaps in my essay. That's how you get feedback like this. If you think that citations take up too much time, then there is an auto citation tool that appears when you have the extension installed. But if you upgrade to Grammarly Pro, you get access to tools that can help you turn wordy sentences into clear, effective ones, or even a plagiarism tracker if your university is really strict on that. [Music]"
c2WtIpgdELE,"Grammarly's features can help you show up confident, even if you're secretly nervous on the inside. I actually asked Grammarly's AI to help me rewrite this in a more confident tone. And boom, confident and clear. Your college professor was wrong. You don't actually have to sound like a corporate bot or hit a certain word count. In fact, it's a lot better to be concise in your communication. Grammarly's AI help you simplify complex information to communicate much more effectively. I have personally been a Grammarly user since 2020 and it has been such a great resource for me. If you're ready to level up your career communication, you can sign up now to get Grammarly for free."
G4dSAzJRdJI,"Let's write my cover letter together. Okay, so this is what I had before. I am looking to gain legal experience and guidance at any capacity. My goal is to learn as much as possible to navigate the legal industry with as much competence and understanding as possible. Terrible, awful, embarrassing. I think I almost crashed out having to read that twice. This is after I used Grammarly. I'm eager to learn from the best, developing the confidence and insight necessary to navigate complexities of the legal landscape. So much better. Okay, here's another one said, ""With a genuine desire to absorb as much knowledge and experience as possible, I am open to any opportunities available to learn. Post Grammarly driven by a sincere enthusiasm for gaining knowledge and experience. I'm eager to explore any opportunities that will allow me to learn."" And girls, yes, Grammarly has given me a 98 overall score. I think this has removed like 25 filler words that I just didn't know I had. It sounds so much better. I also finished that in like 30 minutes."
l78y0Nq1zKc,"[Music] Grammarly just said, ""My agenda is concerningly chaotic."" Okay, that's accurate. From quick edits to tone suggestions, Grammarly makes sure I'm prepared even when I'm not. Hey, sorry I'm late, guys. Traffic was crazy. Grammarly's AI powered tools help me organize my ideas quickly and confidently so I can focus on leading the discussion, not scrambling to figure out what's next."
1sGEN6Vobc0,"At some point in your job search, it is pretty inevitable that you'll be asked, ""Why are you leaving your current role?"" As annoying as this question is, they're asking this to gauge your motivations and make sure you're not going to cause strife or bail as soon as you get a higher job offer. And even though you're really leaving because you're bored out of your mind and you're underpaid and your manager actually drinks toxic juice for breakfast, now is not the time for honesty hour. When you answer this question, focus on the future, not the friction. And with the help of Grammarly's AI features, we can pick that massive list of all the reasons you are ready to move on from your job and turn it into professional forwardlooking motivations. We're not leaving because you found out your co-orker makes $20,000 more than you. You just realize you thrive in environments that promote growth and recognize contributions and are looking for a role where you can leverage your strengths and be part of a supportive team that encourages advancement. My favorite part about Grammarly is you can tweak your responses to sound more confident, more natural, and specific to your experience in the job you're applying for. Try it out and keep going. I'm proud of you."
yqZKi5y8JQQ,"Another wonderful day. Morning all. Can you walk me through what you've done so far? You're stressed about an email you need to write to John. Look, I get it, but he's just an SVP, not a deity. The man literally doesn't know how to spell the word accommodate. Yeah, you're right. We need to rework the copy on these coms before they go out. Girl, do not let this job teach too much of your sanity. Let's have you try Grammarly. I'll reddraft paragraphs three and four. Do you think you can have the first two rewritten in the next couple hours? Grammarly can help you rewrite drafts to sound more confident. With Grammarly Pro, it even provides suggestions to point out missing things such as a deadline or a CTA, which you know would lead to another email or meeting. Oh yeah, I use it a lot to save me time thinning out copy or even brainstorm ideas. Okay, let's see what you got now. Yeah, this is perfect. Don't overthink it. Literally, everyone's making up stuff as they go, so like don't let other people intimidate you. Okay."
DRxZyElXYeE,"Even when I'm trying to take a break, my brain's like write this, review that, answer that, edit that, and of course, everything has to look and sound confident and polished. Does this email sound too passive? Run it through Grammarly, it'll make you sound way more confident. Ugh, I still need to update that campaign script, but I'm totally stuck. You can use their idea generator. It can help you with hooks, structure, and everything you need. Wait, that's really helpful, actually. And if you're short on time, it can even rewrite insurance stuff for you. Honestly, it's like having two extra brains and neither of them need copy. No, that's more like it. Seriously, if you're feeling overwhelmed, using Grammarly makes it way easier. Sign up to try it for free."
iyTwKibn_ds,"- Hey, it's Grammarly...in
classic us style, we have a suggestion. This time, it's not just words. This time, it's work itself. We get it. It's not you. It's all
that stuff in your toolbar. They're promising futuristic
features and smarter solutions, but they've made it your
job to connect the dots. Yikes. AI should not be this hard. May we suggest a better option? What if AI worked everywhere you worked? And made everything smarter so
you could rise above the mess. So you and your team can get
more done. Like, way more. And not only sound your
best, but work your best, too. That's Coda and Grammarly. We make AI work for you, not
the other way around. So you and your team
can do what you do best. Work your magic."
hgIPxuhAAQI,"I think about Grammarly and how it's helped me prepare not just briefs, but really scripts that allow me to step into a presentation and know that I'm saying something with absolute confidence. I'm Alex Diaz. I'm a professional marketer in Seattle. What I call my weekend job, I volunteer with an organization called Key to Change. It's a black le, blackfounded nonprofit focused on music education specifically for children in underserved communities with the goal of not just teaching music, but it's really about developing and supporting them as leaders because I'm moving so fast in the work that I do. Sometimes it takes a minute to think through changing my tone. And I love AI compose because you open it, you write your intention and automatically this paragraph comes out. You have this template that you can play with, add your tone to. AI composed makes it significantly easier to send emails to donors or communicate with the board on what's going on with the organization. Grammarly allows me to take a step back and say, is this really the clearest message you're getting across? And so with Rewrite for clarity, it's able to expand here's what you're trying to say and why. I just wouldn't have thought about it at the time. Grammarly is very much how do we empower and give you confidence that whatever you're creating, whatever you're writing, whatever message you're trying to send that you come across as you intend. Get Grammarly today. [Music]"
55oIwErDr3I,"I'm not going to lie, I use Grammarly every time I write. It helps me get the best grades possible while depleting the least amount of hours of my week. I'm a product marketer who's interested in how do I bring the voice of a user into the work that we do. Grammarly is just this amazing partner. It takes a lot of the heavy lifting off my plate so that I can focus on expanding and elevating ideas. As a media and journalism student, the integrity of my writing is super important. Grammarly's AI Compose can help me narrow down what to write about while preserving my authentic voice as a writer. The critical thinking and just your own personal pizzazz really makes the big difference. Whatever you're creating, whatever you're writing, whatever message you're trying to send, you can do it with a smile on your face and with absolute confidence that it's the right message you want to send. I'm Alex Diaz, Lauren Taylor, Claudia Chow, and I am a Grammarly user."
BI-UOyAZCY0,"Grammarly helps me get the best grades possible while depleting the least amount of hours of my week. I'm Lauren Taylor. I'm a student in Future CMO and I am a Grammarly user. So, when I first got Grammarly, my mom got it for me my junior year of high school to help me with my college application essays. But now, it's kind of cool because it's evolved as a platform. Grammarly's AI Compose can help me narrow down what to write about. I can in 15 20 minutes have a decent outline of what I'm going to be writing over the next week or two. It's nice to have a tool that can improve my productivity. Once I've fully fleshed out a draft, I use Grammarly to start looking at clarity and precision. It can tell me things like add more direct quotes if maybe it's gotten a little stale. As a median journalism student, the integrity of my writing is super important. One of Grammarly's best features is the AI and plagiarism detector. If I quote someone a little too closely, Grammarly can pull that article for me and help me create the citation, which just keeps me honest about who I'm sourcing for information. Other platforms are a little more general. They can serve as search engines. They can kind of edit things. They can kind of site things, but they're a little too general to be truly great. Grammarly is a lot more tailored with writers in mind, with creators in mind, with communicators in mind. If as a student you want to put your best foot forward, Grammarly is your go-to. Download Grammarly for free. [Music]"